{
  "nickname": "use-karma-dev",
  "iac_prefix": "/iac",
  "vpc_runtime_path": "/iac/vpc/use-karma-dev/runtime",
  "clickhouse_runtime_path": "/iac/clickhouse/use-karma-dev/runtime",

  "domain_name": "grafana.usekarma.dev",
  "hosted_zone_id": "Z1234567890ABC",
  "acm_cert_arn": "arn:aws:acm:us-east-1:123456789012:certificate/...",
  "create_dns_record": true,

  "instance_type": "t3.large",

  "connect_group_id": "use-karma-dev-connect",
  "mongo_uri": "mongodb://user:pass@mongo.internal:27017/?replicaSet=rs0",
  "connector_name": "mongo-cdc",
  "connector_config": {
    "mongodb.user": "user",
    "mongodb.password": "pass",
    "mongodb.ssl.enabled": "true"
  },

  "discover_msk_sg_by_name": true,
  "msk_sg_name": "use-karma-dev-sg-msk-srvless",

  "tags": { "Environment": "prod", "Project": "observability", "Owner": "usekarma" }
}
